{
  "$schema": "../schemas/site-discovery.schema.json",
  "schemaVersion": 1,
  "canonicalOrigin": "https://templates.moukaeritai.work",
  "robots": {
    "path": "/robots.txt",
    "policy": "match-document-indexability"
  },
  "sitemap": {
    "path": "/sitemap.xml",
    "pageIds": [
      "site-portal-home",
      "site-policy-composition-coexistence",
      "site-composition-playground",
      "site-capabilities-overview",
      "site-webmcp-guide",
      "site-repository-topology-overview",
      "site-workspace-topology-overview",
      "site-lifecycle-overview",
      "site-repository-trees",
      "site-repository-tree-composition",
      "site-repository-tree-policy",
      "composition-overview",
      "composition-composition-concepts",
      "composition-evaluation-guide",
      "composition-consumer-guide",
      "composition-release-guide",
      "composition-composer-reference",
      "composition-documentation-index",
      "composition-composition-model",
      "composition-catalog-architecture",
      "composition-generated-contract-manifest",
      "composition-composer-mvp",
      "composition-catalog-guide",
      "composition-schema-guide",
      "composition-publication-boundary",
      "composition-provider-maintenance",
      "composition-installer-release",
      "composition-composition-authority-migration",
      "composition-skill-first-use-walkthrough",
      "composition-skill-overview",
      "composition-skill-contract",
      "composition-skill-documentation-index",
      "composition-skill-profiles",
      "composition-skill-capability-map",
      "composition-skill-architecture",
      "composition-website-webapp-selection",
      "composition-web-url-path-design-guidance",
      "composition-web-routes-v1-migration",
      "composition-web-routes-v2-migration",
      "composition-web-routes-v3-migration",
      "composition-web-routes-v4-migration",
      "composition-website-product-walkthrough",
      "composition-webapp-product-walkthrough",
      "composition-webapp-overview",
      "composition-webapp-template",
      "composition-webapp-documentation-index",
      "composition-webapp-contracts",
      "composition-webapp-responsibility-boundaries",
      "composition-webapp-validation-toolchain",
      "composition-surfaces-v2-migration",
      "composition-ui-states-migration",
      "composition-runtime-decision-record",
      "composition-runtime-selection",
      "composition-cli-interface",
      "composition-cli-interface-v2-migration",
      "composition-mcp-interface",
      "composition-mcp-transports",
      "composition-mcp-interface-v2-migration",
      "composition-mcp-apps-interface",
      "composition-mcp-apps-guidance",
      "composition-mcp-apps-v2-migration",
      "composition-webmcp-capability",
      "composition-webmcp-tool-design",
      "composition-webmcp-security",
      "composition-webmcp-testing",
      "composition-browser-interface",
      "composition-pwa-capability",
      "composition-pwa-offline-v2-migration",
      "composition-pwa-update-v2-migration",
      "composition-web-interface-v2-migration",
      "composition-service-interface",
      "composition-service-interface-v2-migration",
      "composition-topology-contract",
      "composition-repository-topology-architecture",
      "composition-bare-worktree",
      "composition-local-checkout-topology-architecture",
      "composition-composition-state",
      "composition-contract-evolution",
      "composition-implementation-evidence",
      "composition-implementation-evidence-v2-migration",
      "composition-implementation-evidence-v3-migration",
      "composition-implementation-evidence-v4-migration",
      "composition-implementation-evidence-v5-migration",
      "composition-implementation-evidence-v6-migration",
      "composition-lifecycle-checkpoints",
      "composition-release-execution",
      "composition-release-execution-v2-migration",
      "composition-release-evidence",
      "composition-release-bundle",
      "policy-overview",
      "policy-provider-navigation",
      "policy-shared-policy-navigation",
      "policy-consumer-policy-navigation",
      "policy-getting-started",
      "policy-policy-concepts",
      "policy-managed-operation",
      "policy-cli",
      "policy-bootstrap",
      "policy-adoption",
      "policy-release-lifecycle",
      "policy-policy-readiness",
      "policy-documentation-publication",
      "policy-publication-catalog",
      "policy-pwa",
      "policy-google-ai-studio",
      "policy-repository-structure",
      "policy-architecture",
      "policy-configuration",
      "policy-policy-profiles",
      "policy-policy-authoring",
      "policy-policy-authority-inventory",
      "policy-review-policy",
      "policy-external-artifact-intake",
      "policy-regression-prevention",
      "policy-bootstrap-model",
      "policy-threat-model",
      "policy-contributing",
      "policy-maintainer-workflow",
      "policy-adr-index",
      "policy-adr-repository-adoption",
      "policy-adr-application-neutral-scope",
      "policy-adr-single-policy-authority",
      "policy-adr-copyable-artifact-policy-adoption",
      "policy-adr-single-agent-policy-skill-runtime-cache",
      "policy-adr-review-authority-and-github-runtime-boundary",
      "policy-adr-review-result-representation-boundary",
      "policy-adr-integrated-bootstrap-skill"
    ]
  },
  "feeds": []
}
